#TAG,COMMON NAME (used in script),Arch name,Debian name,Alpine name,Options,Description
M,xorg-server,xorg-server,xserver-xorg,xorg-server,,"is the graphical server. This first one may take a while as it pulls many other dependencies first on clean installs."
M,xorg-xwininfo,xorg-xwininfo,x11-utils,xorg-xwininfo,,"allows querying information about windows."
M,xorg-xinit,xorg-xinit,xinit,xorg-xinit,,"starts the graphical server."
M,xorg-xset,xorg-xset,x11-xserver-utils,xorg-xset,,"utility for configuring and ajusting X server"
M,polkit,polkit,policykit-1,polkit,,"manages user policies."
M,libertinus-font,libertinus-font,fonts-libertinus,libertinus-font,,"provides the sans and serif fonts for LARBS."
M,ttf-font-awesome,ttf-font-awesome,fonts-font-awesome,font-awesome,,"provides extended glyph support."
M,ttf-dejavu,ttf-dejavu,fonts-dejavu,ttf-dejavu,,"properly displays emojis."
A,lf-git,lf-git,lf,lf,,"is an extensive terminal file manager that everyone likes."
M,ueberzug,ueberzug,ueberzug,ueberzug,,"enables previews in the lf file manager."
M,bc,bc,bc,bc,,"is a mathematics language used for the dropdown calculator."
M,xcompmgr,xcompmgr,xcompmgr,xcompmgr,,"is for transparency and removing screen-tearing."
M,xorg-xprop,xorg-xprop,x11-utils,xorg-xprop,,"is a tool for detecting window properties."
M,arandr,arandr,arandr,arandr,,"allows the user to customize monitor arrangements."
M,dosfstools,dosfstools,dosfstools,dosfstools,,"allows your computer to access dos-like filesystems."
M,libnotify,libnotify,libnotify-bin,libnotify,,"allows desktop notifications."
M,dunst,dunst,dunst,dunst,,"is a suckless notification system."
M,calcurse,calcurse,calcurse,calcurse,,"terminal-based organizer for interactive and command line use"
M,exfat-utils,exfat-utils,exfat-utils,exfat-utils,,"allows management of FAT drives."
M,nsxiv,nsxiv,nsxiv,nsxiv,,"is a minimalist image viewer."
M,xwallpaper,xwallpaper,xwallpaper,xwallpaper,,"sets the wallpaper."
M,ffmpeg,ffmpeg,ffmpeg,ffmpeg,,"can record and splice video and audio on the command line."
M,ffmpegthumbnailer,ffmpegthumbnailer,ffmpegthumbnailer,ffmpegthumbnailer,,"creates thumbnail previews of video files."
M,gnome-keyring,gnome-keyring,gnome-keyring,gnome-keyring,,"serves as the system keyring."
A,gtk-theme-arc-gruvbox-git,gtk-theme-arc-gruvbox-git,gtk-theme-arc-gruvbox,gtk-theme-arc-gruvbox,,"gives the dark GTK theme used in LARBS."
M,python-qdarkstyle,python-qdarkstyle,python3-qdarkstyle,python3-qdarkstyle,,"provides a dark Qt theme."
M,mpd,mpd,mpd,mpd,,"is a lightweight music daemon."
M,mpc,mpc,mpc,mpc,,"is a terminal interface for mpd."
M,mpv,mpv,mpv,mpv,,"is the patrician's choice video player."
M,man-db,man-db,man-db,man-db,,"lets you read man pages of programs."
M,ncmpcpp,ncmpcpp,ncmpcpp,ncmpcpp,,"a ncurses interface for music with multiple formats and a powerful tag editor."
M,newsboat,newsboat,newsboat,newsboat,,"is a terminal RSS client."
A,librewolf-bin,librewolf-bin,librewolf,librewolf,,"is the default browser of LARBS which also comes with ad-blocking and other sensible and necessary features by default."
A,arkenfox-user.js,arkenfox-user.js,arkenfox-user.js,arkenfox-user.js,,"provides hardened security settings for Firefox and Librewolf to avoid Mozilla spyware and general web fingerprinting."
M,noto-fonts,noto-fonts,fonts-noto,noto-fonts,,"is an expansive font package."
M,noto-fonts-emoji,noto-fonts-emoji,fonts-noto-emoji,noto-fonts-emoji,,"is an emoji font."
M,ntfs-3g,ntfs-3g,ntfs-3g,ntfs-3g,,"allows accessing NTFS partitions."
M,wireplumber,wireplumber,wireplumber,wireplumber,,"is the audio system."
M,pipewire-pulse,pipewire-pulse,pipewire-pulse,pipewire-pulse,,"gives pipewire compatibility with PulseAudio programs."
M,pulsemixer,pulsemixer,pulsemixer,pulsemixer,,"is an audio controller."
A,sc-im,sc-im,sc-im,sc-im,,"is an Excel-like terminal spreadsheet manager."
M,maim,maim,maim,maim,,"can take quick screenshots at your request."
A,abook,abook,abook,abook,,"is an offline addressbook usable by neomutt."
M,unclutter,unclutter,unclutter,unclutter,,"hides an inactive mouse."
M,lynx,lynx,lynx,lynx,,"is a terminal browser also used in LARBS for generating in-terminal previews of websites, emails and HTML files."
M,xcape,xcape,xcape,xcape,,"gives the special escape/super mappings of LARBS."
M,xclip,xclip,xclip,xclip,,"allows for copying and pasting from the command line."
M,xdotool,xdotool,xdotool,xdotool,,"provides window action utilities on the command line."
M,yt-dlp,yt-dlp,yt-dlp,yt-dlp,,"can download any YouTube video (or playlist or channel) when given the link."
M,zathura,zathura,zathura,zathura,,"is a pdf viewer with vim-like bindings."
M,zathura-pdf-mupdf,zathura-pdf-mupdf,zathura-pdf-mupdf,zathura-pdf-mupdf,,"allows mupdf pdf compatibility in zathura."
M,poppler,poppler,poppler-utils,poppler,,"manipulates .pdfs and gives .pdf previews and other .pdf functions."
M,mediainfo,mediainfo,mediainfo,mediainfo,,"shows audio and video information and is used in the file browser."
M,atool,atool,atool,atool,,"manages and gives information about archives."
M,fzf,fzf,fzf,fzf,,"is a fuzzy finder tool used for easy selection and location of files."
M,bat,bat,bat,bat,,"can highlight code output and display files and is used to generate previews in the file browser."
M,xorg-xbacklight,xorg-xbacklight,xbacklight,xorg-xbacklight,,"enables changing screen brightness levels."
A,zsh-fast-syntax-highlighting-git,zsh-fast-syntax-highlighting-git,zsh-fast-syntax-highlighting,zsh-fast-syntax-highlighting,,"provides syntax highlighting in the shell."
A,task-spooler,task-spooler,task-spooler,task-spooler,,"queues commands or files for download."
A,simple-mtpfs,simple-mtpfs,simple-mtpfs,simple-mtpfs,,"enables the mounting of cell phones."
A,htop-vim,htop-vim,htop-vim,htop-vim,,"is a graphical and colorful system monitor."
G,dwm,https://github.com/ZmoleCristian/DvaporWaveM.git,https://github.com/ZmoleCristian/DvaporWaveM.git,https://github.com/ZmoleCristian/DvaporWaveM.git,,"is the window manager."
G,dwmblocks,https://github.com/LukeSmithxyz/dwmblocks.git,https://github.com/LukeSmithxyz/dwmblocks.git,https://github.com/LukeSmithxyz/dwmblocks.git,,"serves as the modular status bar."
G,dmenu,https://github.com/ZmoleCristian/dmenu.git,https://github.com/ZmoleCristian/dmenu.git,https://github.com/ZmoleCristian/dmenu.git,,"runs commands and provides a UI for selection."
G,st,https://github.com/LukeSmithxyz/st.git,https://github.com/LukeSmithxyz/st.git,https://github.com/LukeSmithxyz/st.git,,"is my custom build of suckless's terminal emulator."
A,mutt-wizard-git,mutt-wizard-git,mutt-wizard,mutt-wizard,,"is a light-weight terminal-based email system."
M,slock,slock,slock,slock,,"allows you to lock your computer, and quickly unlock with your password."
M,socat,socat,socat,socat,,"is a utility which establishes two byte streams and transfers data between them."
M,moreutils,moreutils,moreutils,moreutils,,"is a collection of useful unix tools."
M,tesseract,tesseract,tesseract,tesseract,,"command-line OCR engine for advance maimpick"
M,tesseract-data-eng,tesseract-data-eng,tesseract-data-eng,tesseract-data-eng,,"english language pack for OCR"
M,firefox,firefox,firefox,firefox,,"Preffered Browser"
